{
  "preference_set_id": "prefset_28ef579f3eca79213662",
  "contract_version": "1.0.0",
  "company_id": "company_demo",
  "actor_id": "actor_demo",
  "preferences": [
    {
      "preference_id": "pref_time",
      "scope": "actor",
      "key": "comparison.time.weight",
      "value": 1.3,
      "strength": 0.8,
      "source": "explicit",
      "provenance": [
        {
          "source_type": "actor_settings",
          "source_ref": "interaction_preferences"
        }
      ],
      "confidence": 1.0,
      "valid_from": null,
      "valid_until": null,
      "metadata": {},
      "authority_effect": "none"
    }
  ],
  "created_at": "2026-09-03T02:00:00Z",
  "metadata": {}
}
