{
  "preference_set_id": "prefset_92937b50202a1c7c7ad3",
  "contract_version": "1.0.0",
  "company_id": "company_demo",
  "actor_id": null,
  "preferences": [
    {
      "preference_id": "pref_cost",
      "scope": "company",
      "key": "comparison.cost.weight",
      "value": 1.25,
      "strength": 0.9,
      "source": "explicit",
      "provenance": [
        {
          "source_type": "company_settings",
          "source_ref": "decision_preferences"
        }
      ],
      "confidence": 1.0,
      "valid_from": null,
      "valid_until": null,
      "metadata": {},
      "authority_effect": "none"
    },
    {
      "preference_id": "pref_sustain",
      "scope": "company",
      "key": "comparison.sustainability.weight",
      "value": 1.4,
      "strength": 0.9,
      "source": "explicit",
      "provenance": [
        {
          "source_type": "company_settings",
          "source_ref": "environment_policy"
        }
      ],
      "confidence": 1.0,
      "valid_from": null,
      "valid_until": null,
      "metadata": {},
      "authority_effect": "none"
    }
  ],
  "created_at": "2026-09-03T02:00:00Z",
  "metadata": {}
}
